### ISSUE TITLE
Invalid sFlow original frame length / Juniper issue

### ISSUE THREAD

**Issue by dkazei** [pavel-odintsov/fastnetmon#893]
Hello.

Some Juniper firmware versions have bug - they report frame length smaller than payload data length (for example Ethernet Frame length 132, IPv4 total length 1500). This leads to invalid bandwidth detection, reported bandwidth is 6-8 times lower than expected.
As a workaround I propose the following patch (git diff output):
```
diff --git a/src/simple_packet_parser_ng.cpp b/src/simple_packet_parser_ng.cpp
index 3294c6c..b4c6940 100644
--- a/src/simple_packet_parser_ng.cpp
+++ b/src/simple_packet_parser_ng.cpp
@@ -84,7 +84,7 @@ parser_code_t parse_raw_packet_to_simple_packet_full_ng(uint8_t* pointer,
         protocol        = ipv4_header->protocol;
         packet.protocol = protocol;
 
-        if (use_packet_length_from_wire) {
+        if (use_packet_length_from_wire && ipv4_header->total_length < length_before_sampling) {
             packet.length = length_before_sampling;
         } else {
             packet.length = ipv4_header->total_length;
```
Unfortunately this should affect not only sFlow protocol, but all of them, and I'm not sure if this is not breaking anything else.
Would be nice if you could accept the patch.
Thanks.

**Comment by pavel-odintsov** [comment]
Hello!

Thank you for report!

We actually have flag which can implement similar thing: https://github.com/pavel-odintsov/fastnetmon/blob/master/src/fastnetmon.conf#L115 and it works this way: https://github.com/pavel-odintsov/fastnetmon/blob/add9b4a02bd6a202a81796321bce08275f145f70/src/unified_parser.cpp#L49 but it's not available for sFlow parser. 

Can you share pcap with example sFlow?

Thank you!

**Comment by dkazei** [comment]
Thanks for your response.
Unfortunately we can not disclose live customer's traffic and I can not limit sFlow to test environment only.
I can only provide sample packet parsed with Wireshark [sample](https://pb.quickpacket.com/?token=1onjb4m78jOTVALzYLOOs7jlc0ojSuCT) with IPs redacted.
As you can see there, first flow sample shows Ethernet **Frame Length: 132** but IPv4 **Total Length: 1500**.
If you need the pcap to test your code, I can build the project with the following flags **-DENABLE_GOBGP_SUPPORT=OFF -DENABLE_CUSTOM_BOOST_BUILD=OFF -DUSE_NEW_ATOMIC_BUILTINS=OFF -DENABLE_PF_RING_SUPPORT=OFF -DENABLE_NETMAP_SUPPORT=OFF -DENABLE_DPI_SUPPORT=OFF -DBUILD_TESTS=OFF -DFASTNETMON_ENABLE_AFPACKET=OFF** and check it on live traffic.
Please let me know if I can help.
Thank you.

**Comment by pavel-odintsov** [comment]
Thank you!

Can you share more details about affected switch model and JunOS version? Thank you!

**Comment by dkazei** [comment]
It's MX204
```
Model: mx204
Junos: 18.2R3-S3.11
...
JUNOS sflow mx [20200329.094740_builder_junos_182_r3_s3]
...
```
Regards,
Dzmitry

**Comment by dkazei** [comment]
I had also seen this on EX4300 2 years ago, but I was not able to reproduce this on it now. Probably it was different firmware.

**Comment by pavel-odintsov** [comment]
Thank you!

For future references:
```
Frame 14: 1294 bytes on wire (10352 bits), 1294 bytes captured (10352 bits)
    Encapsulation type: Ethernet (1)
    Arrival Time: Nov 30, 2020 15:34:51.277435000 +03
    [Time shift for this packet: 0.000000000 seconds]
    Epoch Time: 1606739691.277435000 seconds
    [Time delta from previous captured frame: 0.008730000 seconds]
    [Time delta from previous displayed frame: 0.008730000 seconds]
    [Time since reference or first frame: 0.164104000 seconds]
    Frame Number: 14
    Frame Length: 1294 bytes (10352 bits)
    Capture Length: 1294 bytes (10352 bits)
    [Frame is marked: False]
    [Frame is ignored: False]
    [Protocols in frame: eth:ethertype:ip:udp:sflow:eth:ethertype:ip:tcp:tls:eth:ethertype:vlan:ethertype:ip:tcp:data:eth:ethertype:ip:tcp:tls:eth:ethertype:ip:tcp:tls:eth:ethertype:ip:tcp:eth:ethertype:ip:tcp:tls]
    [Coloring Rule Name: TCP]
    [Coloring Rule String: tcp]
Ethernet II, Src: JuniperN_13:6a:81 (00:23:9c:13:6a:81), Dst: RealtekU_76:5d:7f (52:54:00:76:5d:7f)
    Destination: RealtekU_76:5d:7f (52:54:00:76:5d:7f)
        Address: RealtekU_76:5d:7f (52:54:00:76:5d:7f)
        .... ..1. .... .... .... .... = LG bit: Locally administered address (this is NOT the factory default)
        .... ...0 .... .... .... .... = IG bit: Individual address (unicast)
    Source: JuniperN_13:6a:81 (00:23:9c:13:6a:81)
        Address: JuniperN_13:6a:81 (00:23:9c:13:6a:81)
        .... ..0. .... .... .... .... = LG bit: Globally unique address (factory default)
        .... ...0 .... .... .... .... = IG bit: Individual address (unicast)
    Type: IPv4 (0x0800)
Internet Protocol Version 4, Src: REDACTED, Dst: REDACTED
    0100 .... = Version: 4
    .... 0101 = Header Length: 20 bytes (5)
    Differentiated Services Field: 0x00 (DSCP: CS0, ECN: Not-ECT)
        0000 00.. = Differentiated Services Codepoint: Default (0)
        .... ..00 = Explicit Congestion Notification: Not ECN-Capable Transport (0)
    Total Length: 1280
    Identification: 0x0000 (0)
    Flags: 0x00
        0... .... = Reserved bit: Not set
        .0.. .... = Don't fragment: Not set
        ..0. .... = More fragments: Not set
    Fragment Offset: 0
    Time to Live: 254
    Protocol: UDP (17)
    Header Checksum: 0xa7ae [validation disabled]
    [Header checksum status: Unverified]
    Source Address: REDACTED
    Destination Address: REDACTED
User Datagram Protocol, Src Port: 55233, Dst Port: 6343
    Source Port: 55233
    Destination Port: 6343
    Length: 1260
    Checksum: 0xbb38 [unverified]
    [Checksum Status: Unverified]
    [Stream index: 0]
    [Timestamps]
        [Time since first frame: 0.164104000 seconds]
        [Time since previous frame: 0.008730000 seconds]
    UDP payload (1252 bytes)
InMon sFlow
    Datagram version: 5
    Agent address type: IPv4 (1)
    Agent address: REDACTED
    Sub-agent ID: 0
    Sequence number: 21366
    SysUptime: 18 days, 13 hours, 58 minutes, 2 seconds (1605482423ms)
    NumSamples: 6
    Flow sample, seq 52676520
        0000 0000 0000 0000 0000 .... .... .... = Enterprise: standard sFlow (0)
        .... .... .... .... .... 0000 0000 0001 = sFlow sample type: Flow sample (1)
        Sample length (byte): 208
        Sequence number: 52676520
        0000 0000 .... .... .... .... .... .... = Source ID class: 0
        .... .... 0000 0000 0000 0010 0010 0000 = Index: 544
        Sampling rate: 1 out of 4096 packets
        Sample pool: 1014665216 total packets
        Dropped packets: 0
        Input interface (ifIndex): 544
        Output interface: 0x00000228
            00.. .... .... .... .... .... .... .... = Output interface format: ifindex (0)
            ..00 0000 0000 0000 0000 0010 0010 1000 = Output interface value: 552
        Flow record: 2
        Raw packet header
            0000 0000 0000 0000 0000 .... .... .... = Enterprise: standard sFlow (0)
            Format: Raw packet header (1)
            Flow data length (byte): 144
            Header protocol: Ethernet (1)
            Frame Length: 132
            Payload removed: 4
            Original packet length: 128
            Header of sampled packet: f4bfa8216109508789790c3f0800450005dc7d5b4000f9064a9a4c4c1515ac52a67201bb…
                Ethernet II, Src: Cisco_79:0c:3f (50:87:89:79:0c:3f), Dst: JuniperN_21:61:09 (f4:bf:a8:21:61:09)
                    Destination: JuniperN_21:61:09 (f4:bf:a8:21:61:09)
                        Address: JuniperN_21:61:09 (f4:bf:a8:21:61:09)
                        .... ..0. .... .... .... .... = LG bit: Globally unique address (factory default)
                        .... ...0 .... .... .... .... = IG bit: Individual address (unicast)
                    Source: Cisco_79:0c:3f (50:87:89:79:0c:3f)
                        Address: Cisco_79:0c:3f (50:87:89:79:0c:3f)
                        .... ..0. .... .... .... .... = LG bit: Globally unique address (factory default)
                        .... ...0 .... .... .... .... = IG bit: Individual address (unicast)
                    Type: IPv4 (0x0800)
                Internet Protocol Version 4, Src: REDACTED, Dst: REDACTED
                    0100 .... = Version: 4
                    .... 0101 = Header Length: 20 bytes (5)
                    Differentiated Services Field: 0x00 (DSCP: CS0, ECN: Not-ECT)
                        0000 00.. = Differentiated Services Codepoint: Default (0)
                        .... ..00 = Explicit Congestion Notification: Not ECN-Capable Transport (0)
                    Total Length: 1500
                    Identification: 0x7d5b (32091)
                    Flags: 0x40, Don't fragment
                        0... .... = Reserved bit: Not set
                        .1.. .... = Don't fragment: Set
                        ..0. .... = More fragments: Not set
                    Fragment Offset: 0
                    Time to Live: 249
                    Protocol: TCP (6)
                    Header Checksum: 0x4a9a [validation disabled]
                    [Header checksum status: Unverified]
                    Source Address: REDACTED
                    Destination Address: REDACTED
                Transmission Control Protocol, Src Port: 443, Dst Port: 45419, Seq: 4291860522, Ack: 2582387608
                    Source Port: 443
                    Destination Port: 45419
                    [Stream index: 83]
                    Sequence Number: 4291860522    (relative sequence number)
                    Sequence Number (raw): 4291860522
                    Acknowledgment Number: 2582387608    (relative ack number)
                    Acknowledgment number (raw): 2582387608
                    0101 .... = Header Length: 20 bytes (5)
                    Flags: 0x010 (ACK)
                        000. .... .... = Reserved: Not set
                        ...0 .... .... = Nonce: Not set
                        .... 0... .... = Congestion Window Reduced (CWR): Not set
                        .... .0.. .... = ECN-Echo: Not set
                        .... ..0. .... = Urgent: Not set
                        .... ...1 .... = Acknowledgment: Set
                        .... .... 0... = Push: Not set
                        .... .... .0.. = Reset: Not set
                        .... .... ..0. = Syn: Not set
                        .... .... ...0 = Fin: Not set
                        [TCP Flags: ·······A····]
                    Window: 2002
                    [Calculated window size: 2002]
                    [Window size scaling factor: -1 (unknown)]
                    Checksum: 0x7af1 [unverified]
                    [Checksum Status: Unverified]
                    Urgent Pointer: 0
                    [Timestamps]
                        [Time since first frame in this TCP stream: 0.000000000 seconds]
                        [Time since previous frame in this TCP stream: 0.000000000 seconds]
                    TCP payload (78 bytes)
                Transport Layer Security
        Extended switch data
            0000 0000 0000 0000 0000 .... .... .... = Enterprise: standard sFlow (0)
            Format: Extended switch data (1001)
            Flow data length (byte): 16
            Incoming 802.1Q VLAN: 0
            Incoming 802.1p priority: 0
            Outgoing 802.1Q VLAN: 3
            Outgoing 802.1p priority: 0
    Flow sample, seq 28700745
        0000 0000 0000 0000 0000 .... .... .... = Enterprise: standard sFlow (0)
        .... .... .... .... .... 0000 0000 0001 = sFlow sample type: Flow sample (1)
        Sample length (byte): 208
        Sequence number: 28700745
        0000 0000 .... .... .... .... .... .... = Source ID class: 0
        .... .... 0000 0000 0000 0010 0001 1110 = Index: 542
        Sampling rate: 1 out of 4096 packets
        Sample pool: 1594138624 total packets
        Dropped packets: 0
        Input interface (ifIndex): 552
        Output interface: 0x0000021e
            00.. .... .... .... .... .... .... .... = Output interface format: ifindex (0)
            ..00 0000 0000 0000 0000 0010 0001 1110 = Output interface value: 542
        Flow record: 2
        Raw packet header
            0000 0000 0000 0000 0000 .... .... .... = Enterprise: standard sFlow (0)
            Format: Raw packet header (1)
            Flow data length (byte): 144
            Header protocol: Ethernet (1)
            Frame Length: 132
            Payload removed: 4
            Original packet length: 128
            Header of sampled packet: 5087891ce0fbf4bfa8216107810000030800450005dc04be40003f06c82c68f7d86f3654…
                Ethernet II, Src: JuniperN_21:61:07 (f4:bf:a8:21:61:07), Dst: Cisco_1c:e0:fb (50:87:89:1c:e0:fb)
                    Destination: Cisco_1c:e0:fb (50:87:89:1c:e0:fb)
                        Address: Cisco_1c:e0:fb (50:87:89:1c:e0:fb)
                        .... ..0. .... .... .... .... = LG bit: Globally unique address (factory default)
                        .... ...0 .... .... .... .... = IG bit: Individual address (unicast)
                    Source: JuniperN_21:61:07 (f4:bf:a8:21:61:07)
                        Address: JuniperN_21:61:07 (f4:bf:a8:21:61:07)
                        .... ..0. .... .... .... .... = LG bit: Globally unique address (factory default)
                        .... ...0 .... .... .... .... = IG bit: Individual address (unicast)
                    Type: 802.1Q Virtual LAN (0x8100)
                802.1Q Virtual LAN, PRI: 0, DEI: 0, ID: 3
                    000. .... .... .... = Priority: Best Effort (default) (0)
                    ...0 .... .... .... = DEI: Ineligible
                    .... 0000 0000 0011 = ID: 3
                    Type: IPv4 (0x0800)
                Internet Protocol Version 4, Src: REDACTED, Dst: REDACTED
                    0100 .... = Version: 4
                    .... 0101 = Header Length: 20 bytes (5)
                    Differentiated Services Field: 0x00 (DSCP: CS0, ECN: Not-ECT)
                        0000 00.. = Differentiated Services Codepoint: Default (0)
                        .... ..00 = Explicit Congestion Notification: Not ECN-Capable Transport (0)
                    Total Length: 1500
                    Identification: 0x04be (1214)
                    Flags: 0x40, Don't fragment
                        0... .... = Reserved bit: Not set
                        .1.. .... = Don't fragment: Set
                        ..0. .... = More fragments: Not set
                    Fragment Offset: 0
                    Time to Live: 63
                    Protocol: TCP (6)
                    Header Checksum: 0xc82c [validation disabled]
                    [Header checksum status: Unverified]
                    Source Address: REDACTED
                    Destination Address: REDACTED
                Transmission Control Protocol, Src Port: 60099, Dst Port: 22188, Seq: 3064603668, Ack: 2980902412
                    Source Port: 60099
                    Destination Port: 22188
                    [Stream index: 84]
                    Sequence Number: 3064603668    (relative sequence number)
                    Sequence Number (raw): 3064603668
                    Acknowledgment Number: 2980902412    (relative ack number)
                    Acknowledgment number (raw): 2980902412
                    0101 .... = Header Length: 20 bytes (5)
                    Flags: 0x010 (ACK)
                        000. .... .... = Reserved: Not set
                        ...0 .... .... = Nonce: Not set
                        .... 0... .... = Congestion Window Reduced (CWR): Not set
                        .... .0.. .... = ECN-Echo: Not set
                        .... ..0. .... = Urgent: Not set
                        .... ...1 .... = Acknowledgment: Set
                        .... .... 0... = Push: Not set
                        .... .... .0.. = Reset: Not set
                        .... .... ..0. = Syn: Not set
                        .... .... ...0 = Fin: Not set
                        [TCP Flags: ·······A····]
                    Window: 237
                    [Calculated window size: 237]
                    [Window size scaling factor: -1 (unknown)]
                    Checksum: 0xa036 [unverified]
                    [Checksum Status: Unverified]
                    Urgent Pointer: 0
                    [Timestamps]
                        [Time since first frame in this TCP stream: 0.000000000 seconds]
                        [Time since previous frame in this TCP stream: 0.000000000 seconds]
                    TCP payload (74 bytes)
                Data (70 bytes)
                    Data: f69f15093e7db05c6067262731ea9e30c539801f76128011b64f9197795011936be426b6…
                    [Length: 70]
        Extended switch data
            0000 0000 0000 0000 0000 .... .... .... = Enterprise: standard sFlow (0)
            Format: Extended switch data (1001)
            Flow data length (byte): 16
            Incoming 802.1Q VLAN: 3
            Incoming 802.1p priority: 0
            Outgoing 802.1Q VLAN: 0
            Outgoing 802.1p priority: 0
    Flow sample, seq 27499315
        0000 0000 0000 0000 0000 .... .... .... = Enterprise: standard sFlow (0)
        .... .... .... .... .... 0000 0000 0001 = sFlow sample type: Flow sample (1)
        Sample length (byte): 208
        Sequence number: 27499315
        0000 0000 .... .... .... .... .... .... = Source ID class: 0
        .... .... 0000 0000 0000 0010 0001 1111 = Index: 543
        Sampling rate: 1 out of 4096 packets
        Sample pool: 968048640 total packets
        Dropped packets: 0
        Input interface (ifIndex): 543
        Output interface: 0x00000228
            00.. .... .... .... .... .... .... .... = Output interface format: ifindex (0)
            ..00 0000 0000 0000 0000 0010 0010 1000 = Output interface value: 552
        Flow record: 2
        Raw packet header
            0000 0000 0000 0000 0000 .... .... .... = Enterprise: standard sFlow (0)
            Format: Raw packet header (1)
            Flow data length (byte): 144
            Header protocol: Ethernet (1)
            Frame Length: 132
            Payload removed: 4
            Original packet length: 128
            Header of sampled packet: f4bfa82161083c61040cc3c00800450005bedbdb00007c066618d83ad9c168f7dc5201bb…
                Ethernet II, Src: JuniperN_0c:c3:c0 (3c:61:04:0c:c3:c0), Dst: JuniperN_21:61:08 (f4:bf:a8:21:61:08)
                    Destination: JuniperN_21:61:08 (f4:bf:a8:21:61:08)
                        Address: JuniperN_21:61:08 (f4:bf:a8:21:61:08)
                        .... ..0. .... .... .... .... = LG bit: Globally unique address (factory default)
                        .... ...0 .... .... .... .... = IG bit: Individual address (unicast)
                    Source: JuniperN_0c:c3:c0 (3c:61:04:0c:c3:c0)
                        Address: JuniperN_0c:c3:c0 (3c:61:04:0c:c3:c0)
                        .... ..0. .... .... .... .... = LG bit: Globally unique address (factory default)
                        .... ...0 .... .... .... .... = IG bit: Individual address (unicast)
                    Type: IPv4 (0x0800)
                Internet Protocol Version 4, Src: REDACTED, Dst: REDACTED
                    0100 .... = Version: 4
                    .... 0101 = Header Length: 20 bytes (5)
                    Differentiated Services Field: 0x00 (DSCP: CS0, ECN: Not-ECT)
                        0000 00.. = Differentiated Services Codepoint: Default (0)
                        .... ..00 = Explicit Congestion Notification: Not ECN-Capable Transport (0)
                    Total Length: 1470
                    Identification: 0xdbdb (56283)
                    Flags: 0x00
                        0... .... = Reserved bit: Not set
                        .0.. .... = Don't fragment: Not set
                        ..0. .... = More fragments: Not set
                    Fragment Offset: 0
                    Time to Live: 124
                    Protocol: TCP (6)
                    Header Checksum: 0x6618 [validation disabled]
                    [Header checksum status: Unverified]
                    Source Address: REDACTED
                    Destination Address: REDACTED
                Transmission Control Protocol, Src Port: 443, Dst Port: 33811, Seq: 2431686729, Ack: 1465965056
                    Source Port: 443
                    Destination Port: 33811
                    [Stream index: 85]
                    Sequence Number: 2431686729    (relative sequence number)
                    Sequence Number (raw): 2431686729
                    Acknowledgment Number: 1465965056    (relative ack number)
                    Acknowledgment number (raw): 1465965056
                    0101 .... = Header Length: 20 bytes (5)
                    Flags: 0x010 (ACK)
                        000. .... .... = Reserved: Not set
                        ...0 .... .... = Nonce: Not set
                        .... 0... .... = Congestion Window Reduced (CWR): Not set
                        .... .0.. .... = ECN-Echo: Not set
                        .... ..0. .... = Urgent: Not set
                        .... ...1 .... = Acknowledgment: Set
                        .... .... 0... = Push: Not set
                        .... .... .0.. = Reset: Not set
                        .... .... ..0. = Syn: Not set
                        .... .... ...0 = Fin: Not set
                        [TCP Flags: ·······A····]
                    Window: 875
                    [Calculated window size: 875]
                    [Window size scaling factor: -1 (unknown)]
                    Checksum: 0x0cf6 [unverified]
                    [Checksum Status: Unverified]
                    Urgent Pointer: 0
                    [Timestamps]
                        [Time since first frame in this TCP stream: 0.000000000 seconds]
                        [Time since previous frame in this TCP stream: 0.000000000 seconds]
                    TCP payload (78 bytes)
                Transport Layer Security
        Extended switch data
            0000 0000 0000 0000 0000 .... .... .... = Enterprise: standard sFlow (0)
            Format: Extended switch data (1001)
            Flow data length (byte): 16
            Incoming 802.1Q VLAN: 0
            Incoming 802.1p priority: 0
            Outgoing 802.1Q VLAN: 3
            Outgoing 802.1p priority: 0
    Flow sample, seq 52676521
        0000 0000 0000 0000 0000 .... .... .... = Enterprise: standard sFlow (0)
        .... .... .... .... .... 0000 0000 0001 = sFlow sample type: Flow sample (1)
        Sample length (byte): 196
        Sequence number: 52676521
        0000 0000 .... .... .... .... .... .... = Source ID class: 0
        .... .... 0000 0000 0000 0010 0010 0000 = Index: 544
        Sampling rate: 1 out of 4096 packets
        Sample pool: 1014669312 total packets
        Dropped packets: 0
        Input interface (ifIndex): 544
        Output interface: 0x00000228
            00.. .... .... .... .... .... .... .... = Output interface format: ifindex (0)
            ..00 0000 0000 0000 0000 0010 0010 1000 = Output interface value: 552
        Flow record: 2
        Raw packet header
            0000 0000 0000 0000 0000 .... .... .... = Enterprise: standard sFlow (0)
            Format: Raw packet header (1)
            Flow data length (byte): 132
            Header protocol: Ethernet (1)
            Frame Length: 118
            Payload removed: 4
            Original packet length: 114
            Header of sampled packet: f4bfa8216109508789790c3f0800452800642bee40003b06105e97658110a0ca49e001bb…
                Ethernet II, Src: Cisco_79:0c:3f (50:87:89:79:0c:3f), Dst: JuniperN_21:61:09 (f4:bf:a8:21:61:09)
                    Destination: JuniperN_21:61:09 (f4:bf:a8:21:61:09)
                        Address: JuniperN_21:61:09 (f4:bf:a8:21:61:09)
                        .... ..0. .... .... .... .... = LG bit: Globally unique address (factory default)
                        .... ...0 .... .... .... .... = IG bit: Individual address (unicast)
                    Source: Cisco_79:0c:3f (50:87:89:79:0c:3f)
                        Address: Cisco_79:0c:3f (50:87:89:79:0c:3f)
                        .... ..0. .... .... .... .... = LG bit: Globally unique address (factory default)
                        .... ...0 .... .... .... .... = IG bit: Individual address (unicast)
                    Type: IPv4 (0x0800)
                    Trailer: 0000
                Internet Protocol Version 4, Src: REDACTED, Dst: REDACTED
                    0100 .... = Version: 4
                    .... 0101 = Header Length: 20 bytes (5)
                    Differentiated Services Field: 0x28 (DSCP: AF11, ECN: Not-ECT)
                        0010 10.. = Differentiated Services Codepoint: Assured Forwarding 11 (10)
                        .... ..00 = Explicit Congestion Notification: Not ECN-Capable Transport (0)
                    Total Length: 100
                    Identification: 0x2bee (11246)
                    Flags: 0x40, Don't fragment
                        0... .... = Reserved bit: Not set
                        .1.. .... = Don't fragment: Set
                        ..0. .... = More fragments: Not set
                    Fragment Offset: 0
                    Time to Live: 59
                    Protocol: TCP (6)
                    Header Checksum: 0x105e [validation disabled]
                    [Header checksum status: Unverified]
                    Source Address: REDACTED
                    Destination Address: REDACTED
                Transmission Control Protocol, Src Port: 443, Dst Port: 53205, Seq: 1084655074, Ack: 1777130999
                    Source Port: 443
                    Destination Port: 53205
                    [Stream index: 86]
                    Sequence Number: 1084655074    (relative sequence number)
                    Sequence Number (raw): 1084655074
                    Acknowledgment Number: 1777130999    (relative ack number)
                    Acknowledgment number (raw): 1777130999
                    0101 .... = Header Length: 20 bytes (5)
                    Flags: 0x018 (PSH, ACK)
                        000. .... .... = Reserved: Not set
                        ...0 .... .... = Nonce: Not set
                        .... 0... .... = Congestion Window Reduced (CWR): Not set
                        .... .0.. .... = ECN-Echo: Not set
                        .... ..0. .... = Urgent: Not set
                        .... ...1 .... = Acknowledgment: Set
                        .... .... 1... = Push: Set
                        .... .... .0.. = Reset: Not set
                        .... .... ..0. = Syn: Not set
                        .... .... ...0 = Fin: Not set
                        [TCP Flags: ·······AP···]
                    Window: 83
                    [Calculated window size: 83]
                    [Window size scaling factor: -1 (unknown)]
                    Checksum: 0xa920 [unverified]
                    [Checksum Status: Unverified]
                    Urgent Pointer: 0
                    [Timestamps]
                        [Time since first frame in this TCP stream: 0.000000000 seconds]
                        [Time since previous frame in this TCP stream: 0.000000000 seconds]
                    TCP payload (60 bytes)
                Transport Layer Security
        Extended switch data
            0000 0000 0000 0000 0000 .... .... .... = Enterprise: standard sFlow (0)
            Format: Extended switch data (1001)
            Flow data length (byte): 16
            Incoming 802.1Q VLAN: 0
            Incoming 802.1p priority: 0
            Outgoing 802.1Q VLAN: 948
            Outgoing 802.1p priority: 0
    Flow sample, seq 52676522
        0000 0000 0000 0000 0000 .... .... .... = Enterprise: standard sFlow (0)
        .... .... .... .... .... 0000 0000 0001 = sFlow sample type: Flow sample (1)
        Sample length (byte): 148
        Sequence number: 52676522
        0000 0000 .... .... .... .... .... .... = Source ID class: 0
        .... .... 0000 0000 0000 0010 0010 0000 = Index: 544
        Sampling rate: 1 out of 4096 packets
        Sample pool: 1014673408 total packets
        Dropped packets: 0
        Input interface (ifIndex): 544
        Output interface: 0x00000228
            00.. .... .... .... .... .... .... .... = Output interface format: ifindex (0)
            ..00 0000 0000 0000 0000 0010 0010 1000 = Output interface value: 552
        Flow record: 2
        Raw packet header
            0000 0000 0000 0000 0000 .... .... .... = Enterprise: standard sFlow (0)
            Format: Raw packet header (1)
            Flow data length (byte): 84
            Header protocol: Ethernet (1)
            Frame Length: 70
            Payload removed: 4
            Original packet length: 66
            Header of sampled packet: f4bfa8216109508789790c3f080045000034456a4000340685b031e93649a0ca72adb1be…
                Ethernet II, Src: Cisco_79:0c:3f (50:87:89:79:0c:3f), Dst: JuniperN_21:61:09 (f4:bf:a8:21:61:09)
                    Destination: JuniperN_21:61:09 (f4:bf:a8:21:61:09)
                        Address: JuniperN_21:61:09 (f4:bf:a8:21:61:09)
                        .... ..0. .... .... .... .... = LG bit: Globally unique address (factory default)
                        .... ...0 .... .... .... .... = IG bit: Individual address (unicast)
                    Source: Cisco_79:0c:3f (50:87:89:79:0c:3f)
                        Address: Cisco_79:0c:3f (50:87:89:79:0c:3f)
                        .... ..0. .... .... .... .... = LG bit: Globally unique address (factory default)
                        .... ...0 .... .... .... .... = IG bit: Individual address (unicast)
                    Type: IPv4 (0x0800)
                    Trailer: 0000
                Internet Protocol Version 4, Src: REDACTED, Dst: REDACTED
                    0100 .... = Version: 4
                    .... 0101 = Header Length: 20 bytes (5)
                    Differentiated Services Field: 0x00 (DSCP: CS0, ECN: Not-ECT)
                        0000 00.. = Differentiated Services Codepoint: Default (0)
                        .... ..00 = Explicit Congestion Notification: Not ECN-Capable Transport (0)
                    Total Length: 52
                    Identification: 0x456a (17770)
                    Flags: 0x40, Don't fragment
                        0... .... = Reserved bit: Not set
                        .1.. .... = Don't fragment: Set
                        ..0. .... = More fragments: Not set
                    Fragment Offset: 0
                    Time to Live: 52
                    Protocol: TCP (6)
                    Header Checksum: 0x85b0 [validation disabled]
                    [Header checksum status: Unverified]
                    Source Address: REDACTED
                    Destination Address: REDACTED
                Transmission Control Protocol, Src Port: 45502, Dst Port: 8929, Seq: 78105036, Ack: 2873685043
                    Source Port: 45502
                    Destination Port: 8929
                    [Stream index: 87]
                    Sequence Number: 78105036    (relative sequence number)
                    Sequence Number (raw): 78105036
                    Acknowledgment Number: 2873685043    (relative ack number)
                    Acknowledgment number (raw): 2873685043
                    1000 .... = Header Length: 32 bytes (8)
                    Flags: 0x010 (ACK)
                        000. .... .... = Reserved: Not set
                        ...0 .... .... = Nonce: Not set
                        .... 0... .... = Congestion Window Reduced (CWR): Not set
                        .... .0.. .... = ECN-Echo: Not set
                        .... ..0. .... = Urgent: Not set
                        .... ...1 .... = Acknowledgment: Set
                        .... .... 0... = Push: Not set
                        .... .... .0.. = Reset: Not set
                        .... .... ..0. = Syn: Not set
                        .... .... ...0 = Fin: Not set
                        [TCP Flags: ·······A····]
                    Window: 229
                    [Calculated window size: 229]
                    [Window size scaling factor: -1 (unknown)]
                    Checksum: 0xf2cc [unverified]
                    [Checksum Status: Unverified]
                    Urgent Pointer: 0
                    Options: (12 bytes), No-Operation (NOP), No-Operation (NOP), Timestamps
                        TCP Option - No-Operation (NOP)
                            Kind: No-Operation (1)
                        TCP Option - No-Operation (NOP)
                            Kind: No-Operation (1)
                        TCP Option - Timestamps: TSval 3680472389, TSecr 3288832036
                            Kind: Time Stamp Option (8)
                            Length: 10
                            Timestamp value: 3680472389
                            Timestamp echo reply: 3288832036
                    [Timestamps]
                        [Time since first frame in this TCP stream: 0.000000000 seconds]
                        [Time since previous frame in this TCP stream: 0.000000000 seconds]
        Extended switch data
            0000 0000 0000 0000 0000 .... .... .... = Enterprise: standard sFlow (0)
            Format: Extended switch data (1001)
            Flow data length (byte): 16
            Incoming 802.1Q VLAN: 0
            Incoming 802.1p priority: 0
            Outgoing 802.1Q VLAN: 3
            Outgoing 802.1p priority: 0
    Flow sample, seq 27499316
        0000 0000 0000 0000 0000 .... .... .... = Enterprise: standard sFlow (0)
        .... .... .... .... .... 0000 0000 0001 = sFlow sample type: Flow sample (1)
        Sample length (byte): 208
        Sequence number: 27499316
        0000 0000 .... .... .... .... .... .... = Source ID class: 0
        .... .... 0000 0000 0000 0010 0001 1111 = Index: 543
        Sampling rate: 1 out of 4096 packets
        Sample pool: 968052736 total packets
        Dropped packets: 0
        Input interface (ifIndex): 543
        Output interface: 0x00000228
            00.. .... .... .... .... .... .... .... = Output interface format: ifindex (0)
            ..00 0000 0000 0000 0000 0010 0010 1000 = Output interface value: 552
        Flow record: 2
        Raw packet header
            0000 0000 0000 0000 0000 .... .... .... = Enterprise: standard sFlow (0)
            Format: Raw packet header (1)
            Flow data length (byte): 144
            Header protocol: Ethernet (1)
            Frame Length: 132
            Payload removed: 4
            Original packet length: 128
            Header of sampled packet: f4bfa82161083c61040cc3c00800450003494a7c40003c065732172f963590ac5bf001bb…
                Ethernet II, Src: JuniperN_0c:c3:c0 (3c:61:04:0c:c3:c0), Dst: JuniperN_21:61:08 (f4:bf:a8:21:61:08)
                    Destination: JuniperN_21:61:08 (f4:bf:a8:21:61:08)
                        Address: JuniperN_21:61:08 (f4:bf:a8:21:61:08)
                        .... ..0. .... .... .... .... = LG bit: Globally unique address (factory default)
                        .... ...0 .... .... .... .... = IG bit: Individual address (unicast)
                    Source: JuniperN_0c:c3:c0 (3c:61:04:0c:c3:c0)
                        Address: JuniperN_0c:c3:c0 (3c:61:04:0c:c3:c0)
                        .... ..0. .... .... .... .... = LG bit: Globally unique address (factory default)
                        .... ...0 .... .... .... .... = IG bit: Individual address (unicast)
                    Type: IPv4 (0x0800)
                Internet Protocol Version 4, Src: REDACTED, Dst: REDACTED
                    0100 .... = Version: 4
                    .... 0101 = Header Length: 20 bytes (5)
                    Differentiated Services Field: 0x00 (DSCP: CS0, ECN: Not-ECT)
                        0000 00.. = Differentiated Services Codepoint: Default (0)
                        .... ..00 = Explicit Congestion Notification: Not ECN-Capable Transport (0)
                    Total Length: 841
                    Identification: 0x4a7c (19068)
                    Flags: 0x40, Don't fragment
                        0... .... = Reserved bit: Not set
                        .1.. .... = Don't fragment: Set
                        ..0. .... = More fragments: Not set
                    Fragment Offset: 0
                    Time to Live: 60
                    Protocol: TCP (6)
                    Header Checksum: 0x5732 [validation disabled]
                    [Header checksum status: Unverified]
                    Source Address: REDACTED
                    Destination Address: REDACTED
                Transmission Control Protocol, Src Port: 443, Dst Port: 51379, Seq: 3293035567, Ack: 3073488630
                    Source Port: 443
                    Destination Port: 51379
                    [Stream index: 88]
                    Sequence Number: 3293035567    (relative sequence number)
                    Sequence Number (raw): 3293035567
                    Acknowledgment Number: 3073488630    (relative ack number)
                    Acknowledgment number (raw): 3073488630
                    1000 .... = Header Length: 32 bytes (8)
                    Flags: 0x018 (PSH, ACK)
                        000. .... .... = Reserved: Not set
                        ...0 .... .... = Nonce: Not set
                        .... 0... .... = Congestion Window Reduced (CWR): Not set
                        .... .0.. .... = ECN-Echo: Not set
                        .... ..0. .... = Urgent: Not set
                        .... ...1 .... = Acknowledgment: Set
                        .... .... 1... = Push: Set
                        .... .... .0.. = Reset: Not set
                        .... .... ..0. = Syn: Not set
                        .... .... ...0 = Fin: Not set
                        [TCP Flags: ·······AP···]
                    Window: 501
                    [Calculated window size: 501]
                    [Window size scaling factor: -1 (unknown)]
                    Checksum: 0x8ac7 [unverified]
                    [Checksum Status: Unverified]
                    Urgent Pointer: 0
                    Options: (12 bytes), No-Operation (NOP), No-Operation (NOP), Timestamps
                        TCP Option - No-Operation (NOP)
                            Kind: No-Operation (1)
                        TCP Option - No-Operation (NOP)
                            Kind: No-Operation (1)
                        TCP Option - Timestamps: TSval 2037592168, TSecr 759871182
                            Kind: Time Stamp Option (8)
                            Length: 10
                            Timestamp value: 2037592168
                            Timestamp echo reply: 759871182
                    [Timestamps]
                        [Time since first frame in this TCP stream: 0.000000000 seconds]
                        [Time since previous frame in this TCP stream: 0.000000000 seconds]
                    TCP payload (66 bytes)
                Transport Layer Security
        Extended switch data
            0000 0000 0000 0000 0000 .... .... .... = Enterprise: standard sFlow (0)
            Format: Extended switch data (1001)
            Flow data length (byte): 16
            Incoming 802.1Q VLAN: 0
            Incoming 802.1p priority: 0
            Outgoing 802.1Q VLAN: 3
            Outgoing 802.1p priority: 0```

**Comment by EusaHues** [comment]
Juniper bug ID: [PR1487876 ](https://prsearch.juniper.net/InfoCenter/index?page=prcontent&id=PR1487876)
sFlow only came to MX in 18.1R1, so it's not too suprising it doesn't work right in fundamental ways (not that is should be the case!)
Fixes are listed in all the 19.x and 20.x on that bug ID.

**Comment by pavel-odintsov** [comment]
Nice! Thank you for sharing bug report ID! 

You can find detailed explanation below:

![photo_2020-12-13_13-08-28](https://user-images.githubusercontent.com/2744166/102012805-551d8300-3d44-11eb-9ca9-2f180723cc47.jpg)

**Comment by pavel-odintsov** [comment]
We've added configuration option (disabled by default) sflow_read_packet_length_from_ip_header which can switch from using data from sFlow packet (which is wrong in this case) to using IP header length from parsed packet. 

Please try installing packets from CI and confirm that it works as expected. 

Thank you!

**Comment by dkazei** [comment]
I installed 1.2.0 with your commands.
Seems to be fine with _sflow_read_packet_length_from_ip_header=on_.
Thank you!

**Comment by pavel-odintsov** [comment]
Great! Thank you so much for confirming and reporting this issue!
